{
  "$schema": "http://json-schema.org/draft-07/schema#",
  "title": "Art Hero Identity",
  "description": "Art-direction identity of a humanoid hero (data/art/heroes/<group>/<slug>.json). Name, sex, element, race and class are NOT stored here -- they are pulled from the gameplay card named by cardId. Only look (palette, physique) lives here. A hero with no card (test-bed) sets testBed:true and carries its own name.",
  "type": "object",
  "additionalProperties": false,
  "required": ["art"],
  "allOf": [
    {
      "$comment": "Female card heroes need signature cosmetic colours; test beds (no cardId, reference-photo driven) are exempt.",
      "if": {
        "required": ["cardId", "art"],
        "properties": {"art": {"required": ["physique"], "properties": {"physique": {"required": ["bust"]}}}}
      },
      "then": {
        "properties": {"art": {"properties": {"palette": {"required": ["lipColor", "eyeshadowColor", "blushColor", "nailColor", "lashColor", "browColor", "magicColor", "gemColor"]}}}}
      }
    }
  ],
  "anyOf": [
    {"required": ["cardId"]},
    {"required": ["testBed", "name"], "properties": {"testBed": {"const": true}}}
  ],
  "properties": {
    "cardId": {
      "type": "string",
      "pattern": "^HERO_[A-Z_]+$",
      "description": "Link to the gameplay card (data/cards/**). The card's art.artIdentity must point back at this file."
    },
    "testBed": {"type": "boolean", "description": "True for calibration heroes with no gameplay card"},
    "name": {"type": "string", "description": "Only for testBed heroes; card-linked heroes take name from the card"},
    "art": {
      "type": "object",
      "additionalProperties": false,
      "required": ["palette", "physique"],
      "properties": {
        "negatives": {"type": "array", "items": {"type": "string"}, "description": "Permanent hero-specific negative-prompt terms"},
        "defaultUnderlayer": {"type": "string", "pattern": "^data/art/.+\\.json$", "description": "A-pose underlayer piece used when a pose card sets none (the hero's signature look); override per card with components.underlayer"},
        "defaultFootwear": {"type": "string", "pattern": "^data/art/.+\\.json$", "description": "A-pose shoe piece (legs_feet) filling {{FOOTWEAR}} inside the swimwear pieces; override per card with components.footwear"},
        "defaultSheen": {"type": "string", "pattern": "^data/art/.+\\.json$", "description": "Surface-finish piece (wardrobe/finishes/*.json) filling {{SHEEN}} inside metallic pieces; override per card with components.sheen"},
        "palette": {
          "type": "object",
          "additionalProperties": false,
          "required": ["primaryColor", "accentColors", "eyeColor", "eyeColorGlamour", "hairColor", "skinTone"],
          "anyOf": [{"required": ["hairStyleComponent"]}, {"required": ["hairStyle"]}],
          "properties": {
            "primaryColor": {"type": "string"},
            "accentColors": {"type": "array", "minItems": 1, "items": {"type": "string"}},
            "eyeColor": {"type": "string"},
            "eyeColorGlamour": {"type": "string"},
            "hairColor": {"type": "string", "description": "Base hair colour only; highlights come from hairHighlights"},
            "metal": {"type": "string", "description": "The hero's signature metal (e.g. 'platinum'); feeds {{METAL}} in the metallic underlayer"},
            "nailColor": {"type": "string", "description": "Fingernail and toenail colour ({{NAIL}}); default is 'Light <last word of primaryColor>'"},
            "lipColor": {"type": "string", "description": "Signature lip tint ({{LIP}}), used as 'subtle <lipColor>-tinted satin'; default berry"},
            "eyeshadowColor": {"type": "string", "description": "Signature eyeshadow tone ({{EYESHADOW}}); default is the last word of the first accent colour"},
            "blushColor": {"type": "string", "description": "Signature blush tone ({{BLUSH}}); default unspecified"},
            "lashColor": {"type": "string", "description": "Natural lash colour ({{LASH}}), aligned to the hair; default black. Override per scene (overrides.palette) to make lashes pop"},
            "browColor": {"type": "string", "description": "Natural brow colour ({{BROW}}), aligned to the hair; default unspecified. Override per scene (overrides.palette) to make brows pop"},
            "magicColor": {"type": "string", "description": "Signature spell/energy/glow colour ({{MAGIC}}): eye glow, weapon light, scene effects; default is the last word of the first accent"},
            "gemColor": {"type": "string", "description": "Signature gemstone ({{GEM}}) used in jewelry, e.g. 'aquamarine'; default is the last word of the first accent"},
            "hairHighlights": {"type": "string", "pattern": "^data/art/.+\\.json$", "description": "Highlight-style piece (cosmetics/highlights/<family>/*.json); its {{HIGHLIGHT_COLOR}} is filled from hairHighlightColor"},
            "hairHighlightColor": {"type": "string"},
            "hairColorNegatives": {"type": "array", "items": {"type": "string"}},
            "hairStyleComponent": {"type": "string", "pattern": "^data/art/.+\\.json$", "description": "Path to the default A-pose hairstyle piece"},
            "hairStyle": {"type": "string", "description": "Back-compat literal hairstyle; prefer hairStyleComponent"},
            "skinTone": {"type": "string"},
            "eyeColorNegatives": {"type": "array", "items": {"type": "string"}},
            "skinColorNegatives": {"type": "array", "items": {"type": "string"}}
          }
        },
        "physique": {
          "type": "object",
          "additionalProperties": false,
          "required": ["build", "legs", "raceAlignment", "distinguishingMarks"],
          "oneOf": [
            {"required": ["bust", "hips"], "not": {"anyOf": [{"required": ["chest"]}, {"required": ["waist"]}]}},
            {"required": ["chest", "waist"], "not": {"anyOf": [{"required": ["bust"]}, {"required": ["hips"]}]}}
          ],
          "properties": {
            "build": {"type": "string", "description": "Overall build, the individual one; the X Pose from the original photo uses _settings/phrases.json standardFigure instead (card figureProfile: standard)"},
            "torso": {"type": "string", "description": "Midriff and waist (female); optional"},
            "bust": {"type": "string"},
            "arms": {"type": "string", "description": "Shoulders, arms and hands; optional"},
            "hips": {"type": "string"},
            "chest": {"type": "string"},
            "waist": {"type": "string"},
            "legs": {"type": "string"},
            "raceAlignment": {"type": "string", "description": "Design note about how the body reflects her race; never rendered into a prompt"},
            "distinguishingMarks": {"type": "array", "items": {"type": "string"}}
          }
        }
      }
    },
    "profile": {
      "type": "object",
      "additionalProperties": false,
      "required": ["element", "alignment", "alignmentRank", "archetype"],
      "description": "Design notes for a test-bed hero (Angel Primes): where she or he sits on the good-to-evil spectrum, the element, the archetype and the bonded pet. Never rendered into a prompt; the set scaffolder and the roster table read it.",
      "properties": {
        "element": {"enum": ["Darkness", "Fire", "Grass", "Ice", "Water", "Light", "Earth", "Lightning", "Wind", "Poison", "Neutral"]},
        "alignment": {"type": "string"},
        "alignmentRank": {"type": "integer", "minimum": 1, "maximum": 10, "description": "1 = purest good, 10 = fully fallen"},
        "archetype": {"type": "string"},
        "inspiredBy": {"type": "string", "description": "The tradition the character echoes; no historical angel is used by name"},
        "wings": {"type": "string"},
        "pair": {"type": "string", "description": "Slug of the angel of the other sex with the same element and alignment"},
        "pet": {"type": "string", "pattern": "^data/art/pets/.+\\.json$", "description": "The bonded pet's identity; its bondedTo must point back here"}
      }
    },
    "notes": {"type": "string"}
  }
}
